{
  "mission_id": "TP-RCMO-01-CANONICAL-ENTITIES",
  "task_id": "TP-RCMO-01",
  "parent_task_id": "TP-RCMO-00",
  "created_at": "2026-09-20T09:05:00-03:00",
  "objective": "Transformar a Constituição Cognitiva V1 em contratos lógicos canônicos de entidades, estados, lineage e supersession, sem migration.",
  "baseline_sha": "b14d1e7f24f20bb90168312fbfc7abf401750847",
  "target_branch": "chatgpt/rcmo-01-canonical-entities",
  "worktree": null,
  "owner_role": "R2",
  "dependencies": [
    "NEXT-COGNITIVE-CONSTITUTION-RCMO DONE",
    "Constituição Cognitiva V1 publicada em main",
    "baseline live GitHub/Vercel/Supabase reconciliado em 2026-09-20"
  ],
  "in_scope": [
    "Source e Source Version",
    "Structural Node",
    "Evidence Anchor e Annotation",
    "Claim",
    "Method Definition e Method Execution",
    "RCMO",
    "Proposal",
    "Confirmed Authorial Projection",
    "lineage e supersession",
    "mapping do legado V3.1"
  ],
  "out_of_scope": [
    "migrations",
    "src/**",
    "reprocessamento ou replay",
    "cron Wave 6",
    "UI",
    "deploy manual",
    "promoção automática de autoria"
  ],
  "allowed_tools": [
    "GitHub read/write na branch da missão",
    "Supabase read-only",
    "Vercel read-only",
    "web research quando necessário",
    "CI"
  ],
  "write_scope": [
    "docs/ia/**",
    "docs/agent-system/schemas/**",
    "docs/agent-system/missions/**",
    "OpenAI ChatGPT/**"
  ],
  "risk_level": "HIGH",
  "acceptance_criteria": [
    "schemas lógicos completos e validáveis",
    "invariantes e transições explícitas",
    "namespaces de estado sem colisão",
    "toda promoção autoral continua humana e auditável",
    "mapping para legado V3.1 documentado",
    "nenhuma migration ou mudança funcional",
    "R6 independente antes de merge"
  ],
  "required_evidence": [
    "CONFIRMADO-CODIGO",
    "CONFIRMADO-RUNTIME",
    "CONFIRMADO-CI",
    "CONFIRMADO-EXTERNO quando houver pesquisa"
  ],
  "expected_artifacts": [
    "docs/ia/RCMO_CANONICAL_ENTITY_MODEL_V1.md",
    "docs/ia/RCMO_LEGACY_MAPPING_V3_1.md",
    "docs/agent-system/schemas/cognitive-entity-model.schema.json"
  ],
  "status": "DONE",
  "blocked_by": [],
  "next_handoff": "TP-RCMO-01H post-review schema hardening, then TP-RCMO-02; no migration without separate human gate"
}
